{
  "catalog_id": "unrest-capability-sinks",
  "omissions": [
    {
      "id": "acp-cancel-client-cleanup",
      "implementation": "src/unrest_harness/acp_runner.py:ACPClient.cleanup",
      "reason": "Cancellation carries no caller value and closes already-filtered channels."
    },
    {
      "id": "acp-cancel-read-loop",
      "implementation": "src/unrest_harness/acp_runner.py:ACPClient._read_loop",
      "reason": "Cancellation carries no caller value and closes already-filtered channels."
    },
    {
      "id": "acp-cancel-terminal-review",
      "implementation": "src/unrest_harness/acp_runner.py:ACPNodeRunner._run_terminal_review_lifecycle",
      "reason": "Cancellation carries no caller value; requests delegate to ACPClient.send_request."
    },
    {
      "id": "acp-node-request-callers",
      "implementation": "src/unrest_harness/acp_runner.py:ACPNodeRunner.run_node",
      "reason": "All outbound payloads delegate to the cataloged ACPClient.send_request boundary."
    },
    {
      "id": "acp-session-mode-request-caller",
      "implementation": "src/unrest_harness/acp_runner.py:ACPNodeRunner._maybe_set_mode",
      "reason": "The outbound payload delegates to the cataloged ACPClient.send_request boundary."
    },
    {
      "id": "acp-session-update-callback-delegation",
      "implementation": "src/unrest_harness/acp_runner.py:ACPClient._dispatch",
      "reason": "Session updates are delegated to the configured progress handler, whose implementation owns redaction and display enforcement."
    },
    {
      "id": "acp-terminal-review-progress-print",
      "implementation": "src/unrest_harness/acp_runner.py:ACPTerminalReviewer._report_progress",
      "reason": "The caller supplies output already filtered by the cataloged progress redactor."
    },
    {
      "id": "acp-terminal-review-request-callers",
      "implementation": "src/unrest_harness/acp_runner.py:ACPNodeRunner._run_terminal_review_lifecycle",
      "reason": "All outbound payloads delegate to the cataloged ACPClient.send_request boundary."
    },
    {
      "id": "baseline-cli-output",
      "implementation": "src/unrest_harness/baseline.py:main",
      "reason": "Static operator status contains only fixed counts and generated-path metadata."
    },
    {
      "id": "baseline-fixture-bytes",
      "implementation": "src/unrest_harness/baseline.py:generate_baseline",
      "reason": "Deterministic repository fixtures are generated from the protected baseline model."
    },
    {
      "id": "baseline-running-mission-fixture",
      "implementation": "src/unrest_harness/baseline.py:_seed_running_mission",
      "reason": "Deterministic repository fixture generation is not a runtime value channel."
    },
    {
      "id": "baseline-storage-fixture",
      "implementation": "src/unrest_harness/baseline.py:_storage_state",
      "reason": "Deterministic repository fixture generation is not a runtime value channel."
    },
    {
      "id": "capability-projection-owner-path-reversal",
      "implementation": "src/unrest_harness/capability_policy.py:validate_capability_sink_anchors.effect_implementation",
      "reason": "Reversing the locally accumulated AST owner-name components only constructs a diagnostic implementation path."
    },
    {
      "id": "generated-managed-config-block",
      "implementation": "src/unrest_harness/cli.py:_replace_managed_block",
      "reason": "The caller passes capability-filtered generated configuration."
    },
    {
      "id": "generated-provider-assets",
      "implementation": "src/unrest_harness/cli.py:_setup_provider_assets",
      "reason": "Only immutable packaged assets are copied to this installation surface."
    },
    {
      "id": "generated-provider-settings",
      "implementation": "src/unrest_harness/acp_runner.py:_ensure_claude_settings",
      "reason": "Only fixed capability-mode settings reach the canonical atomic artifact boundary."
    },
    {
      "id": "installed-wheel-lifecycle-fixtures",
      "implementation": "src/unrest_harness/installed_wheel_check.py:run_installed_wheel_check",
      "reason": "The installed-candidate gate writes only fixed provider-independent contract and evidence fixtures inside its isolated temporary project."
    },
    {
      "id": "mock-dispatcher-callback",
      "implementation": "src/unrest_harness/dispatcher.py:MockDispatcher.dispatch",
      "reason": "The in-process test dispatcher delegates only to the explicitly supplied test responder and has no provider or persistence surface."
    },
    {
      "id": "repository-contract-html-stack-reverse",
      "implementation": "src/unrest_harness/repository_contract.py:_SupportedHTMLLabelParser.handle_endtag",
      "reason": "Reversing the parser's in-memory tag-name stack is unrelated to caller values or credential transforms."
    },
    {
      "id": "storage-atomic-json",
      "implementation": "src/unrest_harness/storage.py:atomic_write_json",
      "reason": "Structured values are filtered before delegating to the cataloged atomic text boundary."
    },
    {
      "id": "storage-attempt",
      "implementation": "src/unrest_harness/storage.py:ProjectStore.save_attempt",
      "reason": "JSON and Markdown handoffs delegate to the cataloged canonical atomic artifact boundary."
    },
    {
      "id": "storage-attention",
      "implementation": "src/unrest_harness/storage.py:ProjectStore.save_attention",
      "reason": "Delegates to the cataloged canonical atomic artifact boundary."
    },
    {
      "id": "storage-contract-state",
      "implementation": "src/unrest_harness/storage.py:ProjectStore.save_contract_state",
      "reason": "Delegates to the cataloged canonical atomic artifact boundary."
    },
    {
      "id": "storage-decision",
      "implementation": "src/unrest_harness/storage.py:ProjectStore.append_decision_record",
      "reason": "Delegates to the cataloged canonical atomic artifact boundary."
    },
    {
      "id": "storage-mission-closeout",
      "implementation": "src/unrest_harness/storage.py:ProjectStore.seal_mission",
      "reason": "Delegates to the cataloged canonical atomic artifact boundary."
    },
    {
      "id": "storage-project-create",
      "implementation": "src/unrest_harness/storage.py:ProjectStore.create_project",
      "reason": "All durable values delegate to the cataloged canonical atomic artifact boundary."
    },
    {
      "id": "storage-project-record",
      "implementation": "src/unrest_harness/storage.py:ProjectStore.save_project",
      "reason": "Delegates to the cataloged canonical atomic artifact boundary."
    },
    {
      "id": "storage-state",
      "implementation": "src/unrest_harness/storage.py:ProjectStore.save_state",
      "reason": "Delegates to the cataloged canonical atomic artifact boundary."
    },
    {
      "id": "storage-task-list",
      "implementation": "src/unrest_harness/storage.py:ProjectStore.save_task_list",
      "reason": "Delegates to the cataloged canonical atomic artifact boundary."
    },
    {
      "id": "storage-task-state",
      "implementation": "src/unrest_harness/storage.py:ProjectStore.save_task_state",
      "reason": "Delegates to the cataloged canonical atomic artifact boundary."
    },
    {
      "id": "storage-terminal-review",
      "implementation": "src/unrest_harness/storage.py:ProjectStore.save_terminal_review",
      "reason": "JSON and Markdown reviews delegate to the cataloged canonical atomic artifact boundary."
    },
    {
      "id": "storage-terminal-review-config",
      "implementation": "src/unrest_harness/storage.py:ProjectStore.save_terminal_review_config",
      "reason": "Delegates to the cataloged canonical atomic artifact boundary."
    }
  ],
  "reachable_source_sha256": "41f93d8c5d911156c97edc7b005d1e657c1928d16984da488f93f07d56bdd7b0",
  "schema_version": 1,
  "sinks": [
    {
      "enforcement": "redact_credential_values",
      "id": "acp-adapter-stderr",
      "implementation": "src/unrest_harness/acp_runner.py:ACPNodeRunner.run_node",
      "inventory": "SensitiveValueInventory",
      "sink_class": "diagnostic"
    },
    {
      "enforcement": "_redact_json_value",
      "id": "acp-callback-errors",
      "implementation": "src/unrest_harness/acp_runner.py:ACPClient._handle_request",
      "inventory": "SensitiveValueInventory",
      "sink_class": "protocol"
    },
    {
      "enforcement": "_redact_json_value",
      "id": "acp-callback-results",
      "implementation": "src/unrest_harness/acp_runner.py:ACPClient._handle_request",
      "inventory": "SensitiveValueInventory",
      "sink_class": "protocol"
    },
    {
      "enforcement": "_redact_json_value",
      "id": "acp-outbound-requests",
      "implementation": "src/unrest_harness/acp_runner.py:ACPClient.send_request",
      "inventory": "SensitiveValueInventory",
      "sink_class": "protocol"
    },
    {
      "enforcement": "stream_redactor",
      "id": "acp-progress",
      "implementation": "src/unrest_harness/acp_runner.py:ACPProgressTracker._flush",
      "inventory": "SensitiveValueInventory",
      "sink_class": "protocol"
    },
    {
      "enforcement": "_redact_json_value",
      "id": "acp-request-errors",
      "implementation": "src/unrest_harness/acp_runner.py:ACPClient._handle_response",
      "inventory": "SensitiveValueInventory",
      "sink_class": "protocol"
    },
    {
      "enforcement": "_redact_json_value",
      "id": "acp-request-results",
      "implementation": "src/unrest_harness/acp_runner.py:ACPClient._handle_response",
      "inventory": "SensitiveValueInventory",
      "sink_class": "protocol"
    },
    {
      "enforcement": "_redact_terminal_bytes",
      "id": "acp-terminal-output",
      "implementation": "src/unrest_harness/acp_runner.py:ACPClient._handle_terminal_output",
      "inventory": "SensitiveValueInventory",
      "sink_class": "protocol"
    },
    {
      "enforcement": "_redact_json_value",